id,name,minutes,tags,description,ingredients
382101,hard boiled eggs  easy to peel,22,"['weeknight', '30-minutes-or-less', 'time-to-make', 'course', 'main-ingredient', 'cuisine', 'preparation', 'occasion', 'north-american', 'low-protein', '5-ingredients-or-less', 'very-low-carbs', 'lunch', 'eggs-dairy', 'american', 'easy', 'beginner-cook', 'kid-friendly', 'eggs', 'dietary', 'low-sodium', 'sandwiches', 'low-saturated-fat', 'low-calorie', 'comfort-food', 'low-carb', 'inexpensive', 'toddler-friendly', 'low-in-something', 'taste-mood']","i have had a few problems with trying to hard boil organic fresh chicken eggs. they were usually hard to peel and it would take about half of the egg white with the shell. i ran across this recipe from my sister, of all people...yes, i was skeptical at first...lol! :p  anyway, after you use this simple recipe your eggs will no longer be hard to peel.  it works even on store bought/farm eggs.  i just prefer fresh eggs because they taste so much better.  i wish i could have chickens in the city!  i never knew what i was missing till my daughters great grandmother got 8 chickens.  they eat poms, strawberries, melons, tomatoes, bugs, worms... spoiled little hens.  lol!  they have the best eggs though.","['eggs', 'water', 'salt']"
120884,heavenly scrambled eggs,20,"['30-minutes-or-less', 'time-to-make', 'course', 'main-ingredient', 'cuisine', 'preparation', 'north-american', 'very-low-carbs', 'breakfast', 'eggs-dairy', 'american', 'southern-united-states', 'eggs', 'dietary', 'low-carb', 'low-in-something']",perfect combination of eggs and gravy.  perfect for breakfast or brunch.,"['butter', 'salt', 'flour', 'milk', 'eggs', 'pepper']"
125648,hillbilly bacon,20,"['bacon', '30-minutes-or-less', 'time-to-make', 'main-ingredient', 'preparation', '5-ingredients-or-less', 'pork', 'easy', 'meat', '3-steps-or-less']","not sure why this is called hillbilly bacon, but is sure is good!","['flour', 'brown sugar', 'pepper', 'bacon']"
299759,homemade matzah for passover,20,"['30-minutes-or-less', 'time-to-make', 'course', 'preparation', 'occasion', 'healthy', '5-ingredients-or-less', 'flat-shapes', 'breads', 'easy', 'holiday-event', 'kosher', 'low-fat', 'dietary', 'low-sodium', 'low-cholesterol', 'low-saturated-fat', 'passover', 'healthy-2', 'low-in-something']",home made matzah is so delicious - and so simple to make.,"['flour', 'water', 'olive oil']"
148900,homemade pasta  fettuccine,40,"['60-minutes-or-less', 'time-to-make', 'course', 'main-ingredient', 'preparation', 'for-1-or-2', 'healthy', '5-ingredients-or-less', 'main-dish', 'pasta', 'easy', 'low-fat', 'dietary', 'low-saturated-fat', 'low-in-something', 'pasta-rice-and-grains', 'spaghetti', 'number-of-servings']",for this recipe i usually need to double it for my family of six. i also use half durham flour and half white flour instead. it seems to keep the noodles from getting mushy when cooked.,"['flour', 'salt', 'eggs', 'olive oil', 'water']"
71214,homemade phyllo pastry,30,"['30-minutes-or-less', 'time-to-make', 'cuisine', 'preparation', 'healthy', '5-ingredients-or-less', 'greek', 'easy', 'european', 'dietary', 'low-cholesterol', 'low-saturated-fat', 'healthy-2', 'low-in-something', 'number-of-servings']","something i came across while living abroad. many of the older generation living in the area referred to as the holy land, will use only the homemade version. i don't expect anyone to actually try it, but then again, one never knows. i personally prefer the homemade, as it has a fresher taste than commercially frozen fillo dough's, and the frozen kind can often break if opened too soon, or while warming to room temp, one became rather sticky on me. equipment needed: rolling pin, wooden dowel no less than 24 inches long and 3/4 inch diameter, large cloth, and wax paper.","['flour', 'salt', 'water', 'olive oil']"
331765,homemade spaetzle,20,"['30-minutes-or-less', 'time-to-make', 'course', 'main-ingredient', 'preparation', 'healthy', '5-ingredients-or-less', 'side-dishes', 'pasta', 'easy', 'dietary', 'low-saturated-fat', 'low-in-something', 'pasta-rice-and-grains']",great with dad's hungarian goulash.,"['all-purpose flour', 'eggs', 'salt', 'water']"
471396,homemade spring roll wrappers,84,"['time-to-make', 'course', 'cuisine', 'preparation', 'occasion', 'healthy', '5-ingredients-or-less', 'appetizers', 'asian', 'easy', 'low-fat', 'dietary', 'low-cholesterol', 'low-saturated-fat', 'healthy-2', 'low-in-something', 'taste-mood', '3-steps-or-less', '4-hours-or-less']",this is an easy and quick recipe for making homemade spring roll wrappers. homemade is always better.,"['flour', 'salt', 'water']"
268209,honey wheat popovers,40,"['60-minutes-or-less', 'time-to-make', 'course', 'main-ingredient', 'preparation', 'breads', 'oven', 'easy', 'beginner-cook', 'kid-friendly', 'grains', 'dietary', 'inexpensive', 'toddler-friendly', 'pasta-rice-and-grains', 'equipment']","these are a great if you need a last minute addition to a meal.  they go together fast, taste good and are good for you.  i like to serve with honey butter.  from the makeover moms.","['butter', 'all-purpose flour', 'whole wheat flour', 'salt', 'milk', 'eggs', 'honey']"
423015,honey wheat tortillas,32,"['weeknight', '60-minutes-or-less', 'time-to-make', 'course', 'main-ingredient', 'preparation', 'occasion', 'healthy', '5-ingredients-or-less', 'flat-shapes', 'breads', 'lunch', 'easy', 'beginner-cook', 'vegetarian', 'dietary', 'low-sodium', 'inexpensive', 'low-in-something', 'pasta-rice-and-grains', 'to-go']","yes, once again i've composed a recipe that recreates those same pricey flavored tortillas you can buy in the store- for less the cost, slightly less the calories.","['water', 'butter', 'honey', 'whole wheat flour']"
45260,hong kong fortune cookies,30,"['30-minutes-or-less', 'time-to-make', 'course', 'cuisine', 'preparation', 'occasion', 'drop-cookies', 'hand-formed-cookies', 'desserts', 'asian', 'chinese', 'oven', 'kid-friendly', 'cookies-and-brownies', 'dietary', 'equipment', 'number-of-servings']","this recipe come from a 1978 cookbook called ""the nancy drew cookbook: clues to good cooking"" by carolynn keene. when my daughter paula was 13 years old, i had a birthday party for her and the kids went on a scavenger hunt.  they had to get mysterious things as the theme of the party was a mystery party. then we served refreshments: hot dogs cooked on a bon fire, etc.  then they opened their fortunes.  it was the hit of the party and all had a great time. this is one of paula's most memorable parties! she is 37 now and still likes to tell about that party! i still have that cookbook and love to look at it.","['butter', 'sugar', 'vanilla', 'eggs', 'flour']"
232248,hootenanny,30,"['30-minutes-or-less', 'time-to-make', 'course', 'main-ingredient', 'cuisine', 'preparation', 'north-american', 'pancakes-and-waffles', 'breakfast', 'eggs-dairy', 'american', 'southwestern-united-states', 'oven', 'easy', 'beginner-cook', 'kid-friendly', 'eggs', 'dietary', 'equipment', '3-steps-or-less']",kinda like a pancake/french toast recipe all in one dish.  my kids always loved it.  and it is very easy!!!,"['eggs', 'flour', 'milk', 'salt']"
157638,hootenanny pancakes,35,"['60-minutes-or-less', 'time-to-make', 'course', 'main-ingredient', 'preparation', 'pancakes-and-waffles', 'breakfast', 'eggs-dairy', 'eggs', 'inexpensive']","""volcano pancakes"" may be a more appropriate name.  the pancake will rise a few inches above the pan while baking.  my family says the tall sides are the best part.  this is fast, simple, and delicious and it's so easy to have the ingredients on hand.  i got this from another website and am posting it for my cookbook.","['butter', 'eggs', 'milk', 'salt', 'flour']"
85817,hrudka  easter cheese,35,"['60-minutes-or-less', 'time-to-make', 'course', 'main-ingredient', 'cuisine', 'preparation', 'occasion', '5-ingredients-or-less', 'very-low-carbs', 'side-dishes', 'eggs-dairy', 'easy', 'european', 'beginner-cook', 'holiday-event', 'easter', 'eggs', 'dietary', 'low-sodium', 'low-calorie', 'low-carb', 'low-in-something', 'number-of-servings']","this is a traditional eastern 'cheese' (really an egg ball). during lent we give up all forms of meat and dairy products, then on easter sunday pig out on what we've given up. note: the whey from this is used in my paska recipe, save it and make both!","['eggs', 'milk', 'black pepper', 'salt', 'vanilla']"
124106,hungarian noodles homemade,120,"['time-to-make', 'main-ingredient', 'cuisine', 'preparation', 'for-large-groups', 'healthy', '5-ingredients-or-less', 'pasta', 'hungarian', 'easy', 'european', 'czech', 'dietary', 'pasta-rice-and-grains', 'number-of-servings', '4-hours-or-less']",for one of the ladies at hope lodge. i haven't tried it yet and i'm guessing at the time it will take to make these homemade noodles.,"['flour', 'eggs', 'salt', 'water']"
171106,jamie oliver s huge yorkshire puddings,40,"['60-minutes-or-less', 'time-to-make', 'course', 'cuisine', 'preparation', '5-ingredients-or-less', 'breads', 'easy', 'european', 'english', 'dietary', 'low-sodium', 'low-in-something']",another great recipe from jamie oliver. i made these a couple of times and everyone liked it!,"['milk', 'all-purpose flour', 'salt', 'eggs', 'olive oil']"
104441,julia child method of preparing garlic,35,"['60-minutes-or-less', 'time-to-make', 'course', 'main-ingredient', 'preparation', 'occasion', '5-ingredients-or-less', 'appetizers', 'condiments-etc', 'eggs-dairy', 'vegetables', 'easy', 'diabetic', 'dinner-party', 'vegetarian', 'spreads', 'dietary', 'comfort-food', 'taste-mood', 'savory']","i didn't learn this method by reading it any of julia's books, but rather by watching her show. some of my earliest memories are of sitting with my mother as a little girl, watching julia on the television. i'd even thought for the longest time that mom had named me after her! (it wasn't until a couple of years ago that i found out differently, but i still think of my name as julia's tribute.) i recently went to the smithsonian museum of american history in washington dc and was delighted to discover her kitchen preserved there - i spent a very, very long time just standing there, soaking in as much of her as i could. so, whenever you need garlic in a recipe and you want it nice and soft and oh-so-flavorful, prepare it this way!","['garlic', 'butter', 'olive oil', 'salt']"
23496,kentucky cream candy,25,"['30-minutes-or-less', 'time-to-make', 'course', 'preparation', 'low-protein', 'healthy', '5-ingredients-or-less', 'desserts', 'easy', 'candy', 'dietary', 'low-sodium', 'low-in-something', 'number-of-servings']","dbmnmr
*^*lovingly adopted by mom2 t, k, k & g september 2006 =)*^*","['sugar', 'water', 'butter']"
60149,kielke,35,"['60-minutes-or-less', 'time-to-make', 'course', 'main-ingredient', 'cuisine', 'preparation', 'occasion', 'north-american', 'healthy', '5-ingredients-or-less', 'side-dishes', 'pasta', 'american', 'easy', 'european', 'heirloom-historical', 'holiday-event', 'vegetarian', 'russian', 'stove-top', 'dietary', 'amish-mennonite', 'inexpensive', 'northeastern-united-states', 'pasta-rice-and-grains', 'equipment', 'presentation', 'served-hot']","russian-mennonite noodles, similar to spaetzle. good served with farmer sausage.","['flour', 'salt', 'eggs', 'milk']"
255660,kitchen princess christmas cookies,60,"['60-minutes-or-less', 'time-to-make', 'course', 'preparation', 'occasion', 'for-large-groups', 'low-protein', '5-ingredients-or-less', 'very-low-carbs', 'desserts', 'easy', 'heirloom-historical', 'holiday-event', 'cookies-and-brownies', 'dietary', 'christmas', 'low-sodium', 'low-cholesterol', 'low-saturated-fat', 'low-calorie', 'low-carb', 'low-in-something', 'number-of-servings']","yet another recipe from my kitchen princess books, these are some really cute christmas time treats! they can also be used as ornaments, but before i had the chance to try that, they were all eaten...","['flour', 'sugar', 'egg', 'butter']"
271545,kittencal s perfect poached eggs,7,"['15-minutes-or-less', 'time-to-make', 'course', 'main-ingredient', 'preparation', 'occasion', '5-ingredients-or-less', 'very-low-carbs', 'breakfast', 'eggs-dairy', 'easy', 'beginner-cook', 'holiday-event', 'eggs', 'stove-top', 'dietary', 'christmas', 'comfort-food', 'low-carb', 'inexpensive', 'low-in-something', 'brunch', 'taste-mood', 'equipment']","this is the only method i use for the best poached eggs, you will never go wrong with this recipe!  you may of coarse increase the eggs to whatever amount desired, the addition of a small amount of milk will create a softer egg :)","['eggs', 'water', 'milk', 'salt']"
49904,leche asada,65,"['weeknight', 'time-to-make', 'course', 'main-ingredient', 'cuisine', 'preparation', 'occasion', 'north-american', '5-ingredients-or-less', 'desserts', 'eggs-dairy', 'mexican', 'oven', 'easy', 'puddings-and-mousses', 'eggs', 'south-american', 'dietary', 'low-sodium', 'gluten-free', 'low-calorie', 'inexpensive', 'free-of-something', 'low-in-something', 'equipment', '4-hours-or-less']",this is a delicious latin american custard.,"['eggs', 'milk', 'sugar']"
90391,linda s perfect popovers,80,"['time-to-make', 'course', 'preparation', '5-ingredients-or-less', 'breads', 'oven', 'easy', 'dietary', 'equipment', '4-hours-or-less']","i adore popovers, and this recipe, from a best friend, is my favorite.","['milk', 'all-purpose flour', 'salt', 'butter', 'eggs']"
499338,magic cake,80,"['time-to-make', 'course', 'preparation', 'desserts', 'cakes', 'dietary', 'low-sodium', 'low-in-something', '4-hours-or-less', 'from-scratch']","resembles a custard filled cake, but it does it all on its own!  please follow directions carefully, for best results (e.g. - milk needs to be luke warm, butter allowed to cool).","['eggs', 'water', 'sugar', 'butter', 'flour', 'milk']"
311010,mama s finnish wafers,60,"['60-minutes-or-less', 'time-to-make', 'course', 'preparation', '5-ingredients-or-less', 'drop-cookies', 'desserts', 'easy', 'cookies-and-brownies', 'dietary', '3-steps-or-less']",mama always made these at christmastime,"['sugar', 'butter', 'eggs', 'vanilla extract', 'flour']"
31041,marti s homemade noodles,160,"['weeknight', 'time-to-make', 'course', 'cuisine', 'preparation', 'occasion', 'north-american', 'healthy', '5-ingredients-or-less', 'side-dishes', 'american', 'easy', 'vegetarian', 'dietary', 'comfort-food', 'oamc-freezer-make-ahead', 'taste-mood', 'number-of-servings', '4-hours-or-less']",the easiest noodle recipe i know. tasty too. great for chicken and noodles. there is nothing quite like homemade.  time includes 2 hours of drying time.,"['egg', 'milk', 'salt', 'flour']"
358908,mel boller  danish soup dumplings,50,"['danish', '60-minutes-or-less', 'time-to-make', 'course', 'main-ingredient', 'cuisine', 'preparation', '5-ingredients-or-less', 'clear-soups', 'soups-stews', 'scandinavian', 'easy', 'european', 'pasta-rice-and-grains', 'equipment', 'technique']",these little dumplings are delicious and fluffy and a stable in a traditional danish soup,"['butter', 'water', 'flour', 'eggs', 'salt']"
157367,microwave baked custard,26,"['30-minutes-or-less', 'time-to-make', 'course', 'main-ingredient', 'preparation', 'occasion', '5-ingredients-or-less', 'desserts', 'eggs-dairy', 'easy', 'microwave', 'puddings-and-mousses', 'eggs', 'dietary', 'low-sodium', 'low-calorie', 'comfort-food', 'low-in-something', 'brunch', 'taste-mood', 'equipment']",a delicious custard that is easy to make and never curdles.,"['milk', 'eggs', 'sugar', 'salt', 'vanilla']"
58476,microwave creme caramel,35,"['60-minutes-or-less', 'time-to-make', 'course', 'main-ingredient', 'preparation', 'desserts', 'eggs-dairy', 'microwave', 'puddings-and-mousses', 'dietary', 'low-sodium', 'low-calorie', 'low-in-something', 'equipment']","i love creme caramel and this recipe sounds simple and delicious! i haven't tried it myself yet, but will do soon. cook time includes standing time (but not cooling time)","['milk', 'eggs', 'sugar', 'water']"
94616,milk frosting,35,"['60-minutes-or-less', 'time-to-make', 'course', 'preparation', 'low-protein', 'healthy', '5-ingredients-or-less', 'desserts', 'easy', 'low-fat', 'cakes', 'dietary', 'low-sodium', 'gluten-free', 'low-cholesterol', 'cake-fillings-and-frostings', 'free-of-something', 'low-in-something']",a very simple frosting that i always have the ingredients for.,"['butter', 'sugar', 'milk', 'vanilla']"
362055,miss ellen s pound cake,90,"['time-to-make', 'course', 'preparation', 'desserts', 'cakes', '4-hours-or-less']","this is another recipe from the anne of green gables cookbook, and the story is in anne of windy populars aunt chatty is lamenting because miss ellen will never give it up!","['butter', 'sugar', 'eggs', 'all-purpose flour', 'salt', 'vanilla']"
43126,mrs  corbins butter cookies,375,"['weeknight', 'time-to-make', 'course', 'preparation', '5-ingredients-or-less', 'hand-formed-cookies', 'desserts', 'easy', 'cookies-and-brownies']",this is a recipe that i had received from an old neighbor from when i was a child.,"['butter', 'sugar', 'eggs', 'flour']"
72129,muffin tin popovers,60,"['60-minutes-or-less', 'time-to-make', 'course', 'preparation', 'healthy', '5-ingredients-or-less', 'breads', 'oven', 'easy', 'rolls-biscuits', 'dietary', 'equipment', 'presentation', 'served-hot']","adapted from a mr food recipe. this is one time when nonstick spray just won't do the trick-grease your tins very well using shortening, oil, or butter or the muffins will stick.","['all-purpose flour', 'salt', 'milk', 'eggs']"
180624,munavoi  finnish egg butter,5,"['15-minutes-or-less', 'time-to-make', 'course', 'main-ingredient', 'cuisine', 'preparation', '5-ingredients-or-less', 'very-low-carbs', 'breakfast', 'eggs-dairy', 'scandinavian', 'easy', 'european', 'beginner-cook', 'vegetarian', 'eggs', 'finnish', 'dietary', 'low-carb', 'low-in-something', '3-steps-or-less']",a super easy spread delicious on heavier breads or your morning toast.,"['eggs', 'butter', 'salt']"
175450,my favorite caramel frosting,30,"['30-minutes-or-less', 'time-to-make', 'course', 'preparation', 'occasion', 'low-protein', '5-ingredients-or-less', 'desserts', 'easy', 'dinner-party', 'holiday-event', 'kid-friendly', 'cakes', 'dietary', 'low-sodium', 'cake-fillings-and-frostings', 'low-in-something']","got this recipe from my grandmother. it can be alittle tricky to make if you don't pay attention to the temp. but, it's great.","['sugar', 'milk', 'egg', 'salt', 'butter']"
60413,never fail popovers,40,"['60-minutes-or-less', 'time-to-make', 'course', 'preparation', 'healthy', '5-ingredients-or-less', 'breads', 'oven', 'easy', 'dietary', 'equipment']","easy and great, they make a simple meal extra special!","['eggs', 'milk', 'flour', 'salt']"
91311,no fail homemade noodles,30,"['30-minutes-or-less', 'time-to-make', 'course', 'main-ingredient', 'preparation', 'healthy', '5-ingredients-or-less', 'side-dishes', 'pasta', 'easy', 'dietary', 'pasta-rice-and-grains']",noodles are easy; they just seem hard. try this recipe; you will find it is perfect every time.,"['eggs', 'flour', 'milk', 'salt']"
105830,no beat popovers,35,"['60-minutes-or-less', 'time-to-make', 'course', 'preparation', 'occasion', 'healthy', '5-ingredients-or-less', 'breads', 'breakfast', 'easy', 'dietary', 'comfort-food', 'inexpensive', 'quick-breads', 'brunch', 'taste-mood', 'presentation', 'served-hot']","the secret of these is to start with a cold oven and not to peek for the entire baking time. delicious and super simple to make. we like them for breakfast with butter and honey or strawberry jam. to clarify, i have a popover pan that makes 6, big, tall popovers with this recipe, that is what is in the picture.  you will get more and may have to adjust the baking time less if you use muffin pans as they will not be as high as the actual popover pans.","['eggs', 'milk', 'flour', 'salt']"
234763,norwegian krumkake,75,"['time-to-make', 'course', 'main-ingredient', 'cuisine', 'preparation', 'occasion', 'for-large-groups', '5-ingredients-or-less', 'desserts', 'eggs-dairy', 'scandinavian', 'easy', 'european', 'holiday-event', 'cookies-and-brownies', 'norwegian', 'dietary', 'low-sodium', 'seasonal', 'low-in-something', 'taste-mood', 'sweet', 'number-of-servings', '4-hours-or-less']",a crisp cookie. recipe from food network.,"['sugar', 'butter', 'eggs', 'milk', 'all-purpose flour']"
235292,norwegian pancakes   pannekaken,20,"['30-minutes-or-less', 'time-to-make', 'course', 'main-ingredient', 'cuisine', 'preparation', 'occasion', 'healthy', '5-ingredients-or-less', 'pancakes-and-waffles', 'breakfast', 'desserts', 'eggs-dairy', 'scandinavian', 'easy', 'european', 'norwegian', 'dietary', 'inexpensive', 'brunch', 'taste-mood', 'sweet', 'presentation', 'served-cold', 'served-hot']","i'm posting this for zwt iii.  i found this gem on allrecipes.com.  it was submitted by in da wings who states: ""my norwegian grandmother made this for us as a treat, and it continues to be a favorite my mother makes for my kids. very easy and versatile. serve rolled like a crepe with syrup or jam. can also be a dessert stuffed with a sweetened cream cheese and lingon berry mixture.""","['eggs', 'milk', 'all-purpose flour', 'salt', 'sugar']"
141995,numbers toffee,20,"['30-minutes-or-less', 'time-to-make', 'course', 'preparation', 'occasion', 'for-large-groups', 'low-protein', '5-ingredients-or-less', 'desserts', 'easy', 'beginner-cook', 'kid-friendly', 'candy', 'dietary', 'gifts', 'low-sodium', 'low-in-something', 'number-of-servings']","easy to remember, easy to make. please note that i am only guessing on how much it makes and what size pan to put it in. this can also be made in greased paper patty pans.","['butter', 'vinegar', 'vanilla', 'sugar']"
470634,oeufs au plat,10,"['15-minutes-or-less', 'time-to-make', 'course', 'cuisine', 'preparation', '5-ingredients-or-less', 'very-low-carbs', 'omelets-and-frittatas', 'breakfast', 'french', 'easy', 'european', 'beginner-cook', 'dietary', 'low-carb', 'low-in-something']","a fried egg is a an whole egg fried with minimal accompagnement.
omelet or fried eggs are referred to as (transliterated french ""oeufs au plat"") is a dish made â€‹â€‹from chicken eggs by the method of frying pan quickly through oil or butter, fried egg with a liquid which is in between whites (runny), other than the egg wall drag (""omelette"") is rated up to egg whites and yoke and whites together and then pour into the frying pan. omelet are easy to make, very simple and easy to follow. omelet served with bread and milk as a common breakfast or may be eaten at other times of the day in many homes around the world as well in most of fast foods stores.","['eggs', 'butter', 'salt', 'pepper']"
62799,old fashioned sponge cake,30,"['30-minutes-or-less', 'time-to-make', 'course', 'preparation', 'healthy', 'desserts', 'oven', 'cakes', 'dietary', 'equipment']","just a simple sponge, quick and easy.","['eggs', 'sugar', 'vinegar', 'vanilla', 'flour', 'salt']"
5386,old fashioned vinegar taffy,0,"['15-minutes-or-less', 'time-to-make', 'preparation', 'for-1-or-2', 'low-protein', 'healthy', 'finger-food', 'low-fat', 'dietary', 'low-sodium', 'low-cholesterol', 'low-in-something', 'number-of-servings', 'presentation']",it's a ,"['sugar', 'vinegar', 'water', 'butter', 'vanilla extract']"
170296,our favourite belgian waffles,40,"['60-minutes-or-less', 'time-to-make', 'course', 'main-ingredient', 'cuisine', 'preparation', 'occasion', 'pancakes-and-waffles', 'breakfast', 'desserts', 'eggs-dairy', 'easy', 'european', 'kid-friendly', 'eggs', 'belgian', 'dietary', 'low-sodium', 'comfort-food', 'low-in-something', 'taste-mood']","this is our favourite type of waffles. they normally are eaten hot, but the leftovers are very good cold as well.","['milk', 'eggs', 'butter', 'sugar', 'flour', 'salt']"
135405,oven baked breakfast custard,55,"['60-minutes-or-less', 'time-to-make', 'course', 'preparation', 'breakfast', 'desserts', 'dietary']","absolutely incredible for breakfast or dessert, and so easy to make!!  bubbly and golden on top, this delicious, sweet custard is always the first to go...","['eggs', 'milk', 'sugar', 'salt', 'vanilla', 'butter', 'flour']"
48178,oven pancake puff,22,"['30-minutes-or-less', 'time-to-make', 'course', 'preparation', 'occasion', 'for-1-or-2', '5-ingredients-or-less', 'pancakes-and-waffles', 'breakfast', 'easy', 'kid-friendly', 'dietary', 'comfort-food', 'taste-mood', 'number-of-servings']","warm, quick and comforting morning food!","['eggs', 'flour', 'milk', 'salt', 'butter']"
37825,oven scrambled eggs for a crowd,45,"['60-minutes-or-less', 'time-to-make', 'course', 'main-ingredient', 'preparation', 'occasion', 'for-large-groups', '5-ingredients-or-less', 'very-low-carbs', 'breakfast', 'main-dish', 'eggs-dairy', 'oven', 'easy', 'dinner-party', 'eggs', 'dietary', 'one-dish-meal', 'low-carb', 'inexpensive', 'low-in-something', 'equipment', 'number-of-servings']",cooking for a crowd? a really big crowd? use this easy recipe for an easy egg dish.,"['butter', 'eggs', 'salt', 'milk']"
175046,oven baked sugar cones for ice cream,40,"['60-minutes-or-less', 'time-to-make', 'course', 'cuisine', 'preparation', 'occasion', 'north-american', 'healthy', 'desserts', 'kid-friendly', 'summer', 'frozen-desserts', 'dietary', 'low-sodium', 'seasonal', 'low-in-something', 'taste-mood', 'sweet', 'equipment']","found this neat recipe in ""the ultimate ice cream book"" and thought how neat to share with you guys here. these cones taste somewhat like fortune cookies and are very sturdy.they're easiest to make if you have a nonstick cookie sheet and cone-shaped molds. cone shaped molds are currently being sold at http://kasbahouse.com/1.pizelle.1.htm for about $7 not including s/h or any applicable taxes.","['sugar', 'egg', 'butter', 'vanilla extract', 'milk', 'all-purpose flour']"
