id,name,minutes,tags,description,ingredients
194304,crumb crust,50,"['60-minutes-or-less', 'time-to-make', 'course', 'cuisine', 'preparation', 'occasion', 'north-american', 'for-1-or-2', '5-ingredients-or-less', 'pies-and-tarts', 'desserts', 'easy', 'beginner-cook', 'holiday-event', 'crusts-pastry-dough-2', 'number-of-servings', '3-steps-or-less']",great for apple pies,"['sugar', 'flour', 'butter']"
40276,crumb topping for coffee cake,5,"['15-minutes-or-less', 'time-to-make', 'course', 'main-ingredient', 'cuisine', 'preparation', 'occasion', '5-ingredients-or-less', 'breads', 'german', 'oven', 'easy', 'european', 'potluck', 'finger-food', 'heirloom-historical', 'holiday-event', 'kid-friendly', 'coffee-cakes', 'grains', 'dietary', 'gifts', 'comfort-food', 'pasta-rice-and-grains', 'taste-mood', 'to-go', 'equipment', 'number-of-servings', 'presentation', '3-steps-or-less']","this recipe is from mrs. edgar dreyer, from the cookbook ","['sugar', 'butter', 'flour']"
76907,crustless baked custard pie,55,"['60-minutes-or-less', 'time-to-make', 'course', 'preparation', 'pies-and-tarts', 'desserts', 'oven', 'pies', 'equipment']","no crust to roll out, much less calories, but still so delicious! has a smooth custard filling and a crunchy golden top. just dump all ingredients in blender, then bake. recipe from quick cooking.","['milk', 'eggs', 'butter', 'sugar', 'flour', 'vanilla', 'salt']"
137357,dane dumplings,75,"['time-to-make', 'cuisine', 'preparation', '5-ingredients-or-less', 'scandinavian', 'easy', 'european', 'vegetarian', 'norwegian', 'dietary', 'low-sodium', 'low-in-something', '4-hours-or-less']",from the behrendsen family. these are fluffy and really different from heavy floury dumplings.,"['butter', 'water', 'flour', 'salt', 'eggs']"
446011,danescook cookie mold classic shortbread,50,"['60-minutes-or-less', 'time-to-make', 'course', 'cuisine', 'preparation', 'occasion', 'north-american', '5-ingredients-or-less', 'desserts', 'canadian', 'easy', 'holiday-event', 'cookies-and-brownies', 'gifts']","i keep finding this recipe for my angel teddy bear mold ""in""every place but a safe place there is none safer than www.food.com so here it is in all of the details to enjoy. mold delightful large-sized cookies and treats, perfect for gifts and celebrations this hand-crafted clay mold provides great detail that's works well for marzipan and decorative crafts - wax, clay, papier mache', hand cast paper and more.","['butter', 'sugar', 'vanilla extract', 'flour', 'salt']"
447296,dessert puff pastry,40,"['60-minutes-or-less', 'time-to-make', 'course', 'main-ingredient', 'cuisine', 'preparation', 'occasion', 'breads', 'desserts', 'eggs-dairy', 'easy', 'european', 'dinner-party', 'finger-food', 'holiday-event', 'romantic', 'vegetarian', 'eggs', 'dietary', 'inexpensive', 'free-of-something', 'taste-mood', 'presentation', 'nut-free']","this pastry becomes hallow as it bakes. they're great filled with custard, fresh fruit (crushed strawberries), ice cream... and so easy to make. 
the recipe is adapted from paula dean's chocolate stuffed eclair recipe... modified to suit our sweet tooth. enjoy!","['water', 'butter', 'flour', 'sugar', 'eggs', 'vanilla']"
440398,dutch baby  aka  german pancake or puff pancake,25,"['30-minutes-or-less', 'time-to-make', 'course', 'main-ingredient', 'cuisine', 'preparation', 'occasion', 'for-1-or-2', '5-ingredients-or-less', 'pancakes-and-waffles', 'breakfast', 'eggs-dairy', 'german', 'easy', 'european', 'beginner-cook', 'holiday-event', 'kid-friendly', 'eggs', 'dutch', 'dietary', 'inexpensive', 'number-of-servings', 'from-scratch']","my sister daralyn introduced this recipe to our family soon after she was married. her recipe evolved from a favorite breakfast, to our families standard birthday breakfast. when served for a birthday we add candles and a round of ""happy birthday"" but it tastes just as good without those to amenities!","['eggs', 'milk', 'flour', 'salt', 'butter']"
277824,easy basic crepes,8,"['15-minutes-or-less', 'time-to-make', 'course', 'main-ingredient', 'preparation', 'occasion', 'healthy', '5-ingredients-or-less', 'desserts', 'main-dish', 'eggs-dairy', 'easy', 'dinner-party', 'kid-friendly', 'romantic', 'vegetarian', 'grains', 'eggs', 'stove-top', 'dietary', 'low-sodium', 'low-in-something', 'pasta-rice-and-grains', 'brunch', 'taste-mood', 'equipment']","easy 1-2-3, and it's done!  fill with either sweet or savory fillings, your choice of meat, veggies, or fruit topped with whipped cream.  i've used this recipe for appetizers, entrees, desserts and snacks.  served hot or cold, this recipe can be modified for diets with egg substitute and 2-percent or fat free milk.","['flour', 'salt', 'eggs', 'milk']"
34614,easy caramel sorbet,25,"['30-minutes-or-less', 'time-to-make', 'course', 'preparation', 'occasion', 'low-protein', 'healthy', '5-ingredients-or-less', 'desserts', 'easy', 'low-fat', 'vegan', 'vegetarian', 'frozen-desserts', 'dietary', 'low-sodium', 'low-cholesterol', 'low-saturated-fat', 'low-calorie', 'comfort-food', 'low-in-something', 'taste-mood', 'number-of-servings']","4 ingredients,most you may already have.i just love recipes like this.very easy,and yummy!","['sugar', 'water', 'salt', 'vanilla extract']"
497918,easy homemade noodles,90,"['weeknight', 'time-to-make', 'course', 'main-ingredient', 'cuisine', 'preparation', 'occasion', 'north-american', 'for-1-or-2', 'healthy', '5-ingredients-or-less', 'breads', 'soups-stews', 'pasta', 'australian', 'canadian', 'easy', 'european', 'kid-friendly', 'dietary', 'low-sodium', 'low-in-something', 'pasta-rice-and-grains', 'number-of-servings', '4-hours-or-less', 'from-scratch']","it just takes a few minutes to make wonderful, homemade noodles. all you need is flour, egg and a pinch of salt 2 tablespoons of milk. what a tasty addition to fresh chicken soup! my grand kids love these noodles in chicken broth with shredded chicken. if you are in a hurry you can drop little chunks of the mix into boiling broth instead of rolling, cutting, and letting dry. they are more like dumplings than noodles this way. (they must be very small chunks because if they aren't dried first they puff up...)","['all-purpose flour', 'egg', 'salt', 'milk']"
503199,easy swedish pancakes,20,"['30-minutes-or-less', 'time-to-make', 'course', 'main-ingredient', 'preparation', 'occasion', 'pancakes-and-waffles', 'breakfast', 'eggs-dairy', 'easy', 'kid-friendly', 'eggs', 'dietary', 'low-sodium', 'comfort-food', 'inexpensive', 'toddler-friendly', 'low-in-something', 'brunch', 'taste-mood', 'sweet', 'equipment', '3-steps-or-less']","kari hall says, ""this recipe is so delicious and easy to make.  i come from a really swedish town - rockford, illinois - where swedish pancakes are a favorite for sunday morning breakfast.  my dad used to make these for us at home for a special treat.  serve with butter and maple syrup, or lingonberries if you've got them.""  from allrecipes.com.","['eggs', 'milk', 'all-purpose flour', 'sugar', 'salt', 'butter']"
109179,easy yorkshire puddings,40,"['60-minutes-or-less', 'time-to-make', 'course', 'main-ingredient', 'cuisine', 'preparation', 'occasion', 'side-dishes', 'eggs-dairy', 'oven', 'european', 'english', 'eggs', 'dietary', 'comfort-food', 'inexpensive', 'taste-mood', 'equipment']","i've made these a few times, and they've turned out perfect each time! a traditional yorkshire pudding is made with beef drippings but this recipe uses butter. if you have drippings, by all means use the drippings instead of the butter!","['eggs', 'milk', 'all-purpose flour', 'butter', 'salt']"
58590,egg cheese,30,"['30-minutes-or-less', 'time-to-make', 'main-ingredient', 'preparation', '5-ingredients-or-less', 'eggs-dairy', 'easy', 'cheese', 'dietary', 'low-sodium', 'low-calorie', 'low-carb', 'low-in-something']","this is a recipe that my grandmother made for easter and christmas, was a favorite of the family at all holiday gatherings.found it in an old cookbook of my moms and had to share it with all that might want to try it.hope you enjoy it as much as we do.","['egg', 'milk', 'vanilla', 'sugar', 'salt']"
208673,egg filling for sushi,10,"['15-minutes-or-less', 'time-to-make', 'main-ingredient', 'cuisine', 'preparation', 'for-1-or-2', '5-ingredients-or-less', 'eggs-dairy', 'asian', 'japanese', 'easy', 'vegetarian', 'eggs', 'dietary', 'number-of-servings']",this makes a thick omelette which works very well in sushi. i like to use it in my sushi along with spring onions and mayo,"['eggs', 'flour', 'sugar', 'salt']"
15984,egg gravy   swedish,35,"['60-minutes-or-less', 'time-to-make', 'course', 'main-ingredient', 'cuisine', 'preparation', 'breakfast', 'eggs-dairy', 'scandinavian', 'european', 'swedish', 'eggs', 'stove-top', 'dietary', 'low-carb', 'low-in-something', 'equipment', 'number-of-servings']",adopted recipe!  i found this to be  really yummy. it helps if you make it the consistency of ,"['flour', 'butter', 'salt', 'sugar', 'eggs', 'milk']"
93990,egg roll wrappers,60,"['60-minutes-or-less', 'time-to-make', 'course', 'preparation', 'for-large-groups', 'healthy', '5-ingredients-or-less', 'appetizers', 'easy', 'low-fat', 'dietary', 'low-saturated-fat', 'low-in-something', 'number-of-servings']",easy to make. i have had this recipe for over 20 years and no longer remember where i originally received it. cooking time is approximate total cooking time for all 16 egg rolls.,"['egg', 'flour', 'salt', 'water']"
359793,eggs shaken  not stirred,15,"['15-minutes-or-less', 'time-to-make', 'course', 'main-ingredient', 'preparation', 'occasion', '5-ingredients-or-less', 'very-low-carbs', 'breakfast', 'eggs-dairy', 'easy', 'beginner-cook', 'diabetic', 'kid-friendly', 'eggs', 'dietary', 'low-carb', 'inexpensive', 'toddler-friendly', 'low-in-something', 'brunch']","great recipe to help the kids get involved in the kitchen! my kids are always wanting to stir the eggs when we make scrambled eggs, and half the eggs spill out of the dish from their enthusiastic ""helping!"" this method allows them to help, without making a mess. once the eggs are shaken, they can be stored in the fridge for convenience as well. shake the eggs up before work in the morning, and have breakfast for dinner! or, you can shake your eggs up before bed, and have breakfast done in minutes.","['eggs', 'milk', 'salt', 'pepper']"
97832,english shortbread,30,"['30-minutes-or-less', 'time-to-make', 'course', 'cuisine', 'preparation', 'occasion', '5-ingredients-or-less', 'desserts', 'oven', 'easy', 'european', 'holiday-event', 'cookies-and-brownies', 'english', 'scottish', 'bar-cookies', 'christmas', 'equipment']","i've been making this shortbread for years. it's easy and quick to make, with only three ingredients. when i serve it at gatherings, someone always requests the recipe!","['butter', 'sugar', 'all-purpose flour']"
272433,fannie farmer s pound cake,95,"['time-to-make', 'course', 'preparation', 'desserts', 'cakes', '4-hours-or-less']","i found this recipe on television over 20 years ago.  it consistently is the best pound cake i have made.  it has been adapted for modern times.  a true pound cake is a pound each of butter, sugar, flour and eggs.  this recipe is half.","['butter', 'sugar', 'eggs', 'flour', 'salt', 'vanilla']"
335865,fast cookies for grandkids,17,"['lactose', '30-minutes-or-less', 'time-to-make', 'course', 'cuisine', 'preparation', 'occasion', 'north-american', '5-ingredients-or-less', 'rolled-cookies', 'desserts', 'easy', 'beginner-cook', 'holiday-event', 'cookies-and-brownies', 'dietary', 'comfort-food', 'inexpensive', 'egg-free', 'free-of-something', 'taste-mood']","when the grandkids come over and you need to make some cookies fast, this will do the trick. easy and few ingredients.","['all-purpose flour', 'butter', 'sugar', 'vanilla']"
229516,filipino lumpia wrappers,45,"['60-minutes-or-less', 'time-to-make', 'cuisine', 'preparation', 'south-west-pacific', 'healthy', '5-ingredients-or-less', 'easy', 'low-fat', 'dietary', 'low-sodium', 'low-saturated-fat', 'polynesian', 'low-in-something']",if you can't find a filipino store to get wrappers..you can make your own. from alohaworldc.com,"['flour', 'egg', 'water']"
117025,finnish kropser  baked pancake,35,"['60-minutes-or-less', 'time-to-make', 'course', 'main-ingredient', 'cuisine', 'preparation', 'pancakes-and-waffles', 'breakfast', 'eggs-dairy', 'scandinavian', 'oven', 'european', 'finnish', 'equipment']",dh was thrilled when i came up with this recipe (it was a favorite of his as a child!),"['eggs', 'sugar', 'salt', 'milk', 'all-purpose flour', 'butter']"
504246,finnish kropser  baked pancakes,35,"['60-minutes-or-less', 'time-to-make', 'course', 'preparation', 'pancakes-and-waffles', 'breakfast', 'easy', '3-steps-or-less']",this is a tasty breakfast bar.  serve it with your favorite syrup. i found this recipe on the internet.,"['eggs', 'sugar', 'salt', 'milk', 'flour', 'butter']"
324639,flan  japanese or asian style,31,"['60-minutes-or-less', 'time-to-make', 'course', 'main-ingredient', 'preparation', 'occasion', 'desserts', 'lunch', 'snacks', 'eggs-dairy', 'easy', 'steam', 'dinner-party', 'cakes', 'eggs', 'stove-top', 'dietary', 'low-sodium', 'inexpensive', 'low-in-something', 'brunch', 'taste-mood', 'to-go', 'equipment', 'presentation', 'served-cold', 'technique']","flan! it's a creamy custard dessert with a caramel top that looks cute and tastes delicious. however this is not mexican flan. it's styled how they make it in asia, mainly japan. and in this recipe we'll be using cute teacups  because the conduct heat better! if you don't have teacups plastic cups will do fine especially since plastic cups will give the shape of traditional flan.

this recipe will make 4 servings so you need 4 cups!","['milk', 'sugar', 'eggs', 'vanilla', 'water']"
111008,flop proof crepes,25,"['30-minutes-or-less', 'time-to-make', 'course', 'main-ingredient', 'cuisine', 'preparation', 'occasion', 'pancakes-and-waffles', 'breakfast', 'desserts', 'eggs-dairy', 'german', 'easy', 'european', 'beginner-cook', 'dinner-party', 'kid-friendly', 'eggs', 'dietary', 'gifts', 'presentation', 'served-hot']","one of my favorite breakfast recipes, these crepes are delicious, quick, and easy!!!","['eggs', 'milk', 'water', 'salt', 'flour', 'butter']"
118047,fluffy oven scrambled eggs,30,"['30-minutes-or-less', 'time-to-make', 'course', 'main-ingredient', 'preparation', '5-ingredients-or-less', 'very-low-carbs', 'breakfast', 'eggs-dairy', 'easy', 'eggs', 'dietary', 'low-carb', 'low-in-something']","this is an easy way to do scrambled eggs while you prepare the rest of your breakfast.  recipe can be halved very easily and baked in an 8"" square baking dish for the same amount of time.  recipe from allrecipes.","['butter', 'eggs', 'salt', 'milk']"
123656,french vanilla crepes,5,"['15-minutes-or-less', 'time-to-make', 'course', 'main-ingredient', 'cuisine', 'preparation', 'occasion', 'for-large-groups', 'healthy', 'flat-shapes', 'pancakes-and-waffles', 'breads', 'breakfast', 'eggs-dairy', 'easy', 'european', 'beginner-cook', 'holiday-event', 'kid-friendly', 'romantic', 'eggs', 'dietary', 'brunch', 'taste-mood', 'equipment', 'number-of-servings']","i had to make a fancy dessert for about 45 people so i made one up. i served these crepes filled with a sweet ricotta filling, froze them and drizzled them with raspberry and chocolate sauce and whipped cream. they were a huge hit and very simple. they work great at breakfast time with fruit or egg filling too.","['eggs', 'salt', 'flour', 'milk', 'sugar', 'vanilla', 'butter']"
96087,fresh made manicotti or cannelloni crepes shells,15,"['15-minutes-or-less', 'time-to-make', 'main-ingredient', 'preparation', 'healthy', '5-ingredients-or-less', 'pasta', 'easy', 'dietary', 'pasta-rice-and-grains', 'manicotti']","this is really a crepe and not a shell, to be used in your favorite manicotti or cannelloni recipes. these are tender, and in my opinion the flavor is nicer than store-bought. the batter can be flavored by the addition of dried basil or oregano, or use your imagination. simply place the filling in the center of each crepe vertically, then bring each side towards the center, placing seam-side down in your baking dish. voila! you have a filled manicotti with none of the time and mess associated with trying to stuff a store-bought shell. i find this method alot more fun ! they will expand during baking so allow plenty of room in your baking dish.","['flour', 'milk', 'egg', 'salt']"
262538,fried eggs,5,"['15-minutes-or-less', 'time-to-make', 'course', 'main-ingredient', 'preparation', 'occasion', 'for-1-or-2', '5-ingredients-or-less', 'very-low-carbs', 'main-dish', 'eggs-dairy', 'easy', 'eggs', 'dietary', 'one-dish-meal', 'low-carb', 'low-in-something', 'brunch', 'number-of-servings']",fried eggs always succeed,"['eggs', 'butter', 'salt']"
220141,froise  rolled pancakes,15,"['15-minutes-or-less', 'time-to-make', 'course', 'preparation', 'healthy', '5-ingredients-or-less', 'pancakes-and-waffles', 'breakfast', 'easy', 'dietary', 'low-sodium', 'low-in-something']","my mom made these for us for a special treat. they're like a thin pancake, and we fill them with butter and sugar or jam.","['eggs', 'milk', 'flour']"
109196,galuska for stew  dumplings,30,"['30-minutes-or-less', 'time-to-make', 'course', 'preparation', '5-ingredients-or-less', 'side-dishes', 'easy']",sister-in-law gave me this recipe. i make it a lot as it is very easy. makes enough for 4 people.,"['eggs', 'flour', 'water', 'salt', 'butter']"
261361,german dumplings  spaetzle or kniffles  for soup or saute,20,"['30-minutes-or-less', 'time-to-make', 'course', 'main-ingredient', 'cuisine', 'preparation', 'occasion', 'north-american', 'healthy', '5-ingredients-or-less', 'side-dishes', 'soups-stews', 'eggs-dairy', 'american', 'german', 'easy', 'european', 'fall', 'heirloom-historical', 'holiday-event', 'kid-friendly', 'vegetarian', 'eggs', 'dietary', 'seasonal', 'comfort-food', 'midwestern', 'inexpensive', 'pasta-rice-and-grains', 'taste-mood', 'presentation', 'served-hot']","when our church decided to host a ""german reformation night"" dinner, i went hunting for authentic german recipes.  here is one that fits the bill.   there are two ways to make the dumplings (explained below).  serving ideas suggested below too.   gushundheit--!","['eggs', 'water', 'salt', 'flour']"
406738,german egg pancakes,30,"['30-minutes-or-less', 'time-to-make', 'course', 'main-ingredient', 'preparation', 'occasion', 'for-large-groups', '5-ingredients-or-less', 'flat-shapes', 'pancakes-and-waffles', 'breads', 'breakfast', 'eggs-dairy', 'easy', 'kid-friendly', 'spring', 'eggs', 'dietary', 'low-sodium', 'seasonal', 'low-in-something', 'taste-mood', 'savory', 'number-of-servings', '3-steps-or-less']",pancakes,"['eggs', 'milk', 'flour']"
438738,german pancake  puff pancake,20,"['30-minutes-or-less', 'time-to-make', 'course', 'main-ingredient', 'cuisine', 'preparation', 'for-1-or-2', '5-ingredients-or-less', 'pancakes-and-waffles', 'breakfast', 'eggs-dairy', 'german', 'easy', 'european', 'beginner-cook', 'eggs', 'dietary', 'low-sodium', 'inexpensive', 'low-in-something', 'number-of-servings', '3-steps-or-less']",i love this recipe.  my grandma had always made it for me and when i make it for family and friends they love it too! it's quick and easy and uses everything you already have at home.,"['butter', 'eggs', 'milk', 'flour']"
255748,german pancake shreds  for clear soups,13,"['15-minutes-or-less', 'time-to-make', 'course', 'main-ingredient', 'cuisine', 'preparation', 'occasion', 'low-protein', '5-ingredients-or-less', 'very-low-carbs', 'condiments-etc', 'eggs-dairy', 'german', 'easy', 'european', 'beginner-cook', 'dinner-party', 'eggs', 'dietary', 'low-sodium', 'low-cholesterol', 'low-saturated-fat', 'low-calorie', 'low-carb', 'garnishes', 'inexpensive', 'low-in-something', 'taste-mood', 'presentation', 'served-hot']","this is my final recipe from *modern german food* by roz denny. roz says ""soup can be an elegant, light starter to warm you & whet your appetite. germans are great soup makers & have a wonderful variety of accompaniments including pancake shreds."" with all due respect to roz, i had to amend her recipe slightly to make this work for me but ... as shown here, these pancakes are a fun, very easy & make-ahead way to dress up a clear soup w/just a bit of meat (or veggies + potatoes as you like). pls see my notes at the end of the prep & *enjoy* !","['flour', 'egg', 'milk', 'salt']"
61108,german pancakes  from the mennonite treasury of recipes,25,"['30-minutes-or-less', 'time-to-make', 'course', 'cuisine', 'preparation', 'north-american', 'healthy', '5-ingredients-or-less', 'pancakes-and-waffles', 'breakfast', 'main-dish', 'american', 'german', 'easy', 'european', 'kid-friendly', 'dietary', 'amish-mennonite', 'inexpensive', 'northeastern-united-states', 'number-of-servings']",these are very thin pancakes and they are a real favourite of my kids! i usually have to make a double recipe to make sure my husband and i will get some too! my kids love these and in mennonite tradition these are eaten as a supper! funny eh?,"['flour', 'salt', 'eggs', 'milk']"
216474,giant sized popovers,70,"['time-to-make', 'course', 'preparation', 'breads', 'breakfast', 'oven', 'rolls-biscuits', 'equipment', '4-hours-or-less']","i discovered this recipe in lee lee's recipe box.  the description to the recipe reads as follows: ""these giant-size popovers are made in individual containers to allow lots of room for rising.  they can be filled with creamed ham, chicken, or seafood and served as a main dish, or they can be served piping hot with plenty of butter.""  be sure when you make these to spread the custard cups out.  these babies puff up pretty big ; )  i hope you will enjoy them!","['eggs', 'milk', 'butter', 'flour', 'sugar', 'salt']"
50402,good ol  aussie damper,11,"['15-minutes-or-less', 'time-to-make', 'course', 'main-ingredient', 'cuisine', 'preparation', 'occasion', 'south-west-pacific', 'for-1-or-2', 'healthy', '5-ingredients-or-less', 'breads', 'lunch', 'eggs-dairy', 'australian', 'oven', 'easy', 'beginner-cook', 'finger-food', 'holiday-event', 'kid-friendly', 'low-fat', 'picnic', 'vegetarian', 'dietary', 'low-sodium', 'low-cholesterol', 'low-saturated-fat', 'comfort-food', 'brown-bag', 'healthy-2', 'quick-breads', 'low-in-something', 'taste-mood', 'to-go', 'equipment', 'number-of-servings', 'presentation']","this is an australian bread which has been made for over 100 years. it was made by people camping in the bush by mixing flour and water, but now milk and salt are used for flavor. enjoy the bread spread with jam. there are many variations to the recipe too, such as pumpkin damper. the dough was traditionally places on a stick and cooked over a fire (much the same way toasted marshmallows. are made)","['all-purpose flour', 'salt', 'milk']"
1975,grandma hornsby s homemade noodles,0,"['15-minutes-or-less', 'time-to-make', 'course', 'main-ingredient', 'preparation', 'healthy', '5-ingredients-or-less', 'main-dish', 'pasta', 'easy', 'dietary', 'low-saturated-fat', 'low-in-something', 'pasta-rice-and-grains', 'number-of-servings']",,"['salt', 'all-purpose flour', 'egg']"
419998,grandma s butter cookies,18,"['30-minutes-or-less', 'time-to-make', 'course', 'cuisine', 'preparation', 'north-american', '5-ingredients-or-less', 'rolled-cookies', 'desserts', 'easy', 'beginner-cook', 'cookies-and-brownies']",these are easy cookies to make and very easy to eat! can't go wrong with grandma's butter cookies! hope you enjoy!,"['butter', 'egg', 'vanilla', 'sugar', 'flour']"
160402,grandmother kirkwood s white sauce,20,"['30-minutes-or-less', 'time-to-make', 'course', 'preparation', '5-ingredients-or-less', 'sauces', 'condiments-etc', 'easy']",this is a favorite recipe of mine that i remember my grandmother making. hope you enjoy it.,"['butter', 'flour', 'milk', 'salt', 'pepper']"
45057,grandpa higginbottom s popcorn balls,35,"['60-minutes-or-less', 'time-to-make', 'course', 'main-ingredient', 'preparation', 'occasion', 'low-protein', 'healthy', '5-ingredients-or-less', 'desserts', 'easy', 'holiday-event', 'low-fat', 'candy', 'stove-top', 'dietary', 'low-sodium', 'low-cholesterol', 'halloween', 'low-in-something', 'equipment', 'number-of-servings']",my family made these popcorn balls every year for halloween.....as did my father's family and his father's family before them. a real family tradition! i don't give them out anymore but still make them every year for friends and family. serving size is for one batch but two brown paper shopping bags full of popped corn will make approximately 150 popcorn balls. younger children should be very careful because they can burn their hands when making these. teenagers are much more suited for the job! enjoy!,"['vinegar', 'water', 'sugar', 'butter', 'vanilla']"
535853,granny jones  secret salty sweet biscuit recipe,150,"['time-to-make', 'course', 'preparation', 'for-1-or-2', 'low-protein', 'healthy', '5-ingredients-or-less', 'appetizers', 'breads', 'easy', 'low-fat', 'dietary', 'low-cholesterol', 'low-saturated-fat', 'low-in-something', 'number-of-servings', '4-hours-or-less']",perfect for grandchildren,"['flour', 'water', 'salt', 'sugar', 'butter']"
142565,greek travelling pie,55,"['60-minutes-or-less', 'time-to-make', 'course', 'main-ingredient', 'cuisine', 'preparation', '5-ingredients-or-less', 'desserts', 'eggs-dairy', 'greek', 'easy', 'european', 'beginner-cook', 'cakes', 'dietary', 'low-sodium', 'low-in-something']","these are more similar to a cake than a pie, so i'm not sure where the name comes from. supposedly, these mini cakes were eaten by greek warriors when they were traveling. i made these on our last road trip. they kept well as long as they stayed wrapped. the kids loved them. zaar world tour 05","['butter', 'egg', 'flour', 'sugar']"
